{
  "id": "NOM-0107",
  "version": "1.0.0",
  "title": "Manage changes after MVP with the compatibility contract",
  "summary": "After inauguration, classify bug fixes, additive changes and incompatible changes against supported behavior and version them under the project's approved SemVer policy.",
  "statement": "After inauguration, classify bug fixes, additive changes and incompatible changes against supported behavior and version them under the project's approved SemVer policy.",
  "rationale": "Independently normalized public-safe operational guidance.",
  "language": "en",
  "status": "published",
  "norm": {
    "kind": "obligation",
    "predicate": {
      "action": "manage",
      "object": "manage_changes_after_mvp_with_the_compatibility_contract",
      "target": "project_mvp_lifecycle"
    },
    "permission_strength": "not_applicable",
    "conditions": [
      "A user-authorized MVP review, inauguration or post-MVP maintenance operation is taking place."
    ],
    "exceptions": [
      "No implicit authorization to publish tags, releases or deployments."
    ],
    "bounds": {
      "quantifier": "unspecified",
      "interpretation": "unspecified",
      "frequency": "unspecified",
      "minimum": null,
      "maximum": null,
      "unit": "unspecified",
      "window": null,
      "cue": null,
      "basis": "unresolved"
    }
  },
  "categories": {
    "domains": [
      "project_management",
      "software_development",
      "releases"
    ],
    "topics": [
      "mvp_inauguration"
    ],
    "audiences": [
      "ai_agents",
      "human_authors",
      "automations"
    ]
  },
  "scope": {
    "axes": {
      "channel": [
        "any"
      ],
      "visibility": [
        "any"
      ],
      "artifact_kind": [
        "any"
      ],
      "actor": [
        "any"
      ]
    },
    "preconditions": [
      "A user-authorized MVP review, inauguration or post-MVP maintenance operation is taking place."
    ],
    "exclusions": [
      "No implicit authorization to publish tags, releases or deployments."
    ]
  },
  "authority": {
    "source": "Reviewed Nomos guidance; explicitly selected use only",
    "tier": "general_guidance",
    "priority": 0,
    "override_policy": "explicit_resolution"
  },
  "relations": {
    "conflicts_with": [],
    "exceptions_to": [],
    "refines": [],
    "depends_on": [
      "NOM-0054",
      "NOM-0055",
      "NOM-0056"
    ]
  },
  "provenance": {
    "source_type": "authored",
    "reference": "SPEC-0111; processing/specimens/PROC-SPEC-0111.json",
    "license": "MIT",
    "notes": "Standalone opt-in rule, no inherited application."
  },
  "governance": {
    "created_on": "2026-10-21",
    "updated_on": "2026-10-21",
    "review_status": "approved"
  },
  "export_targets": [
    "agents_md",
    "chatgpt_custom_instructions",
    "plain_text"
  ]
}
