{
  "id": "NOM-0041",
  "version": "1.1.0",
  "title": "Verify CI outcomes",
  "summary": "Report whether each relevant check was successful, failed, skipped or pending rather than presuming success.",
  "statement": "Report whether each relevant check was successful, failed, skipped or pending rather than presuming success.",
  "rationale": "General development guidance scoped to the original specimen's trigger.",
  "language": "en",
  "status": "published",
  "norm": {
    "kind": "obligation",
    "predicate": {
      "action": "practice",
      "object": "verify_ci_outcomes",
      "target": "authorized_project_work"
    },
    "permission_strength": "not_applicable",
    "conditions": [
      "When reporting automated validation",
      "Applies only when expressly selected for a matching project or authorized development workflow.",
      "This rule does not itself authorize changes to other repositories, publication or destructive work."
    ],
    "exceptions": [],
    "bounds": {
      "quantifier": "unspecified",
      "interpretation": "unspecified",
      "frequency": "unspecified",
      "minimum": null,
      "maximum": null,
      "unit": "unspecified",
      "window": null,
      "cue": null,
      "basis": "unresolved"
    }
  },
  "categories": {
    "domains": [
      "software_development",
      "ci_cd"
    ],
    "topics": [
      "development_hygiene"
    ],
    "audiences": [
      "ai_agents",
      "human_authors",
      "automations"
    ]
  },
  "scope": {
    "axes": {
      "channel": [
        "any"
      ],
      "visibility": [
        "any"
      ],
      "artifact_kind": [
        "any"
      ],
      "actor": [
        "any"
      ]
    },
    "preconditions": [
      "When reporting automated validation"
    ],
    "exclusions": [
      "Projects or operations outside authorized task scope"
    ]
  },
  "authority": {
    "source": "Published opt-in hygiene rule; no project-wide activation or execution authorization",
    "tier": "general_guidance",
    "priority": 0,
    "override_policy": "explicit_resolution"
  },
  "relations": {
    "conflicts_with": [],
    "exceptions_to": [],
    "refines": [],
    "depends_on": []
  },
  "provenance": {
    "source_type": "authored",
    "reference": "SPEC-0040; processing/specimens/PROC-SPEC-0040.json",
    "license": "MIT",
    "notes": "Public-safe abstraction; independent atom, not automatically enacted by group membership. Explicit catalog review approved; applicability and permission checks remain required."
  },
  "governance": {
    "created_on": "2026-10-21",
    "updated_on": "2026-10-21",
    "review_status": "approved"
  },
  "export_targets": [
    "agents_md",
    "chatgpt_custom_instructions",
    "plain_text"
  ]
}
