{
  "id": "NOM-0010",
  "version": "1.1.0",
  "title": "Create structured roadmaps with stable emoji identities",
  "summary": "New projects must begin with a clear roadmap of phases, milestones, subtasks, and features; give each roadmap item its own stable identifying emoji separate from status.",
  "statement": "New projects must begin with a clear roadmap of phases, milestones, subtasks, and features; give each roadmap item its own stable identifying emoji separate from status.",
  "rationale": "Normalized public-safe rule proposal from an explicitly authorized specimen analysis.",
  "language": "en",
  "status": "published",
  "norm": {
    "kind": "obligation",
    "predicate": {
      "action": "define",
      "object": "roadmap_identity",
      "target": "new_project"
    },
    "permission_strength": "not_applicable",
    "conditions": [
      "Applies when creating a project from scratch."
    ],
    "exceptions": [],
    "bounds": {
      "quantifier": "all",
      "interpretation": "universal",
      "frequency": "unspecified",
      "minimum": null,
      "maximum": null,
      "unit": "entities",
      "window": null,
      "cue": "each roadmap item",
      "basis": "explicit_text"
    }
  },
  "categories": {
    "domains": [
      "governance",
      "software_development"
    ],
    "topics": [
      "project_roadmap"
    ],
    "audiences": [
      "ai_agents",
      "human_authors",
      "automations"
    ]
  },
  "scope": {
    "axes": {
      "channel": [
        "any"
      ],
      "visibility": [
        "any"
      ],
      "artifact_kind": [
        "any"
      ],
      "actor": [
        "any"
      ]
    },
    "preconditions": [],
    "exclusions": []
  },
  "authority": {
    "source": "Published in Nomos by explicit batch authorization; general guidance, never automatically applied",
    "tier": "general_guidance",
    "priority": 0,
    "override_policy": "explicit_resolution"
  },
  "relations": {
    "conflicts_with": [],
    "exceptions_to": [],
    "refines": [],
    "depends_on": []
  },
  "provenance": {
    "source_type": "authored",
    "reference": "SPEC-0009; processing/specimens/PROC-SPEC-0009.json",
    "license": "MIT",
    "notes": "Public-safe normalized candidate; source conversation is not reproduced. Catalog decision recorded in downstream processing tasks; not automatically applicable to any project."
  },
  "governance": {
    "created_on": "2026-10-21",
    "updated_on": "2026-10-21",
    "review_status": "approved"
  },
  "export_targets": [
    "agents_md",
    "chatgpt_custom_instructions",
    "plain_text"
  ]
}
