{
  "id": "NOM-0128",
  "version": "0.1.0",
  "title": "Keep Tarium project manifests and public membership claims accurate",
  "summary": "Keep local Tarium manifests and publicly advertised ontology and gallery entry points consistent with published project resources and actual registry state; never claim a project is enrolled merely because it has a template or is compatible with Tarium.",
  "statement": "Keep local Tarium manifests and publicly advertised ontology and gallery entry points consistent with published project resources and actual registry state; never claim a project is enrolled merely because it has a template or is compatible with Tarium.",
  "rationale": "Tarium's public constitution defines a specialized, independently selectable project requirement. Overlap with general Nomos guidance is intentionally preserved and auditable.",
  "language": "en",
  "status": "draft",
  "norm": {
    "kind": "obligation",
    "predicate": {
      "action": "maintain",
      "object": "manifest_and_membership_accuracy",
      "target": "tarium_project_repository"
    },
    "permission_strength": "not_applicable",
    "conditions": [
      "The task concerns an independently authorized public Tarium candidate or member project."
    ],
    "exceptions": [
      "This rule does not authorize Tarium membership changes, private-material disclosure, or unrelated repository operations."
    ],
    "bounds": {
      "quantifier": "unspecified",
      "interpretation": "unspecified",
      "frequency": "unspecified",
      "minimum": null,
      "maximum": null,
      "unit": "unspecified",
      "window": null,
      "cue": null,
      "basis": "unresolved"
    }
  },
  "categories": {
    "domains": [
      "governance",
      "agent_instructions"
    ],
    "topics": [
      "tarium_manifest_consistency"
    ],
    "audiences": [
      "ai_agents",
      "human_authors",
      "automations"
    ]
  },
  "scope": {
    "axes": {
      "channel": [
        "any"
      ],
      "visibility": [
        "public"
      ],
      "artifact_kind": [
        "any"
      ],
      "actor": [
        "any"
      ]
    },
    "project_types": [
      "tarium_project"
    ],
    "preconditions": [
      "The user has separately authorized the relevant project task; Tarium membership remains a separately approved operation."
    ],
    "exclusions": [
      "No automatic cross-repository action, enrollment, or publication of nonpublic source data."
    ]
  },
  "authority": {
    "source": "Reviewed public-document normalization candidate, retained for provenance",
    "tier": "general_guidance",
    "priority": 0,
    "override_policy": "explicit_resolution"
  },
  "relations": {
    "conflicts_with": [],
    "exceptions_to": [],
    "refines": [],
    "depends_on": []
  },
  "provenance": {
    "source_type": "public_document",
    "reference": "https://github.com/sguzman/tarium/blob/main/CONSTITUTION.md; GOVERNANCE.md; registry/schema.json; templates/project/tarium.json; SPEC-0132; processing/specimens/PROC-SPEC-0132.json",
    "license": "MIT",
    "notes": "Public governance-based abstraction; no private source conversation retained. Rule publication does not create project membership or apply it to a repository."
  },
  "governance": {
    "created_on": "2026-10-22",
    "updated_on": "2026-10-22",
    "review_status": "unreviewed"
  },
  "export_targets": [
    "agents_md",
    "chatgpt_custom_instructions",
    "plain_text"
  ],
  "semantic": {
    "concept": "tarium_membership_consistency",
    "aliases": [
      "explicit_membership_authorization"
    ]
  }
}
